{
  "schema_version": 1,
  "persona_id": "tomas-alvarez",
  "person_name": "Tomás Alvarez",
  "background": {
    "demographics": [
      "61 years old"
    ],
    "occupation": "Literature teacher",
    "life_context": [
      "Enjoys testing an interpretation against evidence that may complicate it",
      "Keeps personal reading notes distinct from classroom preparation"
    ],
    "reading_habits": [
      "Marks passages that support and challenge the same interpretation",
      "Often writes a confident first claim and then qualifies it after rereading"
    ],
    "voice_notes": [
      "Analytical and evidence-led without making every note an essay",
      "Comfortable stating a strong view and later admitting it was projection"
    ],
    "recurring_themes": [
      "Whether Alice becomes more self-assured",
      "The difference between textual support and a reader's projection",
      "What opposing evidence does to an attractive interpretation"
    ],
    "guardrails": [
      "Do not make every entry sound like a lecture or classroom exercise",
      "Do not equate age with rigidity or authority",
      "Do not infer nationality, politics, religion, or family details from his name"
    ]
  },
  "reading_list": [
    {
      "book_id": "pg11",
      "book_version_id": "pg11-v01b38ea4",
      "title": "Alice's Adventures in Wonderland",
      "author": "Lewis Carroll",
      "interest": "Passages that might support or challenge the view that Alice becomes more self-assured"
    }
  ],
  "history_profile": {
    "start_date": "2026-03-01",
    "span_days": 90,
    "entry_count": 14,
    "generation_chunk_size": 4,
    "position_expression": "precise",
    "media_frequency": "none",
    "claim_style": "assertive",
    "external_reference_density": "low",
    "entry_length_mix": {
      "short": 3,
      "medium": 7,
      "long": 4
    },
    "entry_word_ranges": {
      "short": {"min_words": 1, "max_words": 30},
      "medium": {"min_words": 31, "max_words": 165},
      "long": {"min_words": 166, "max_words": 350}
    },
    "planned_event_counts": {
      "durable_reflections": 5,
      "explicit_preferences_or_intentions": 1,
      "concrete_incidents": 2,
      "later_updates": 3,
      "unrelated_notes": 3,
      "transient_notes": 2,
      "sensitive_speculations": 0,
      "corrections": 1,
      "deletion_requests": 0,
      "near_duplicates": 1,
      "reconnect_queries": 2
    },
    "attachments": {
      "allowed_kinds": [],
      "target_count": 0,
      "description_rules": []
    }
  }
}
